normal,gen_z,Word/Phrase,Definition,Popularity/Trend Level
That decision was ridiculous; he is inept at his job.,"That decision was ridiculous, he’s an IWIAM.",,,
"She texted me, I was so nervous.","She texted me, IWSN!",,,
"That conversation became somewhat awkward, if you know what I mean.","That conversation got a little awkward, IYKWIM.",,,
"In your opinion, what is the best method for learning computer programming?","IYO, what’s the best way to learn coding?",,,
You are always so thoughtful.,"IYQ, you’re always so thoughtful.",,,
"I do not believe that is going to be successful, but I suppose so.","I don’t think it’s going to work, but IYSS.",,,
What are you doing today?,What are j00 up to today?,,,
Is that your car outside?,Is that j00r car outside?,,,
"Just a sec, I will return immediately.","JAC, I’ll be right back.",,,
"Hold on, just a minute while I finish this.","Hold on, JAM while I finish this.",,,
"Just a second, allow me to retrieve my phone.","JAS, let me grab my phone.",,,
"Hello JC, have you sent the email?","JC, did you send that email?",,,
"You have been hesitating for too long, just do it.","You’ve been hesitating too long, JDI!",,,
Did you attend the concert? I am very jealous.,You went to the concert? I’m so JELLY!,,,
I took the quiz just for fun; it is not serious.,"I took the quiz JFF, it’s not serious.",,,
I do not know the answer; please search for the information yourself.,"I don’t know the answer, JFGI!",,,
"Take an umbrella, just in case it rains.","Take an umbrella, JIC it rains.",,,
I did not intend for that to happen.,"I didn’t mean it, JJ!",,,
Do not take this seriously; I am just joking.,"Don’t take it seriously, I’m JJA.",,,
I am going to move to Mars. Just kidding!,I’m moving to Mars… JK!,,,
"If you are available tomorrow, please let me know.","If you’re free tomorrow, JLMK.",,,
"Just my opinion, but I think the first movie was better.","JMO, but I think the first movie was better.",,,
"I was not being serious, Jean-Paul.","I wasn’t being serious, JP!",,,
We achieved a significant victory with that business agreement.,We hit the JP with that business deal!,,,
"Please do not become upset, I am just kidding.","Don’t get mad, I’m JT!",,,
"Just to let you know, the meeting has been moved to 3 PM.","JTLYK, the meeting’s been moved to 3 PM.",,,
We are initiating a joint venture with another company.,We’re starting a JV with another company.,,,
I am just wondering if you were still planning to come tonight.,JW if you were still planning to come tonight?,,,
"I will see you later, okay?","I’ll see you later, K?",,,
"Okay, is anyone present?","KK, anyone home?",,,
"Okay, I will meet you at the restaurant.","KK, I’ll meet you at the restaurant.",,,
Katie is coming to the party tonight.,K8T is coming to the party tonight.,,,
"I require a new keyboard, as mine is malfunctioning.","I need a new k/b, mine is broken.",,,
My keyboard stopped working.,My KB stopped working.,,,
Go and perform exceptionally well in your presentation.,Go out there and KB in your presentation!,,,
That joke caused me to laugh uncontrollably.,That joke had me KDFU!,,,
That new game is excellent.,That new game is KEWL!,,,
"I am busy now, but contact me when I am available.","I’m busy now, but KEYA when I’m free.",,,
Contact me once you arrive at the hotel.,KEYME once you arrive at the hotel.,,,
Goodnight! Keep faith in yourself!,Goodnight! KFY!,,,
He is someone who is knowledgeable and often corrects others.,"He’s such a KIA, always correcting people.",,,
"No matter what happens, just keep it real.","No matter what happens, just KIR.",,,
Remember the KISS principle while writing the report.,Remember the KISS principle while writing the report.,,,
"It was great seeing you, keep in touch.","It was great seeing you, KIT!",,,
"If they dislike the situation, they can kiss my posterior.","If they don’t like it, they can KMA.",,,
"If you do not agree with my opinion, you may disregard it.",Don’t like my opinion? KMK!,,,
I have an excessive amount of homework and it is overwhelming me.,"I have so much homework, KMS.",,,
"You do not agree? Well, kindly move along.","You don’t agree? Well, KMT.",,,
I gave her a kiss on the cheek when we said goodbye.,I gave her a KOC when we said goodbye.,,,
He is a key opinion leader in the technology industry.,He’s a KOL in the tech industry.,,,
"She is someone obsessed with Korean culture, constantly watching Korean dramas.","She’s a total Koreaboo, always watching K-dramas.",,,
I am going to sleep right now; I will text you later.,"KOS right now, I’ll text you later.",,,
That opposing organization is to be killed on sight in this vicinity.,That enemy guild is KOS in this area.,,,
I have not been ill for the entire year.,"I haven’t been sick all year, KOW!",,,
We said goodbye with a kiss on the cheek.,We said goodbye with a KOTC.,,,
"Look at my new sneakers, they are the best footwear of the day.","Check out my new sneakers, KOTD!",,,
We had our first King of the League game last night.,We had our first KOTL last night.,,,
"It has been a difficult day, do you know what I mean?","It’s been a tough day, KNIM?",,,
He is very knowledgeable about computers.,He’s got a lot of KNOW about computers.,,,
"We remained out late; keep the peace, everyone!","We stayed out late, KPC!",,,
That player just stole my kill in the game.,That player just KS’d me in the game!,,,
"That joke was funny, I know, so cool.","That joke was funny, KSC.",,,
I am spending time with KT this evening.,I’m hanging out with KT tonight.,,,
Your presentation was excellent; keep up the good work.,"Your presentation was awesome, KUTGW!",,,
That was a significant mistake.,"That was such a bad move, KYS!",,,
Would you like to go for a coffee?,L2G for a coffee?,,,
"That sounds excellent, I have to go.","That sounds great, I L2G!",,,
"We are heading out to dinner, do you want to come?","We’re heading out to dinner, L2K?",,,
You frequently perish prematurely; you need to learn to play better.,"You keep dying early, L2P!",,,
His coding skills are excellent.,His coding skills are so l33t.,,,
"Please follow my social media account, and I will follow yours in return.",Follow me for a L4L!,,,
I will see you later.,I’ll catch you L8R!,,,
"I must depart now, talk to you later.","Gotta run, L8RG8R!",,,
"This week has been so stressful, best friend.","This week has been so stressful, LAB.",,,
"That was an amusing statement, laugh out loud at yourself.","That was a good one, LBAY!",,,
"You need to stop doing that, little B*tch.","You need to stop doing that, LBS.",,,
"I am amused, but seriously, you must correct that.","I’m laughing, but LBVS, you need to fix that.",,,
"It has been enjoyable, long distance.","It’s been fun, LD!",,,
We have been in a long-distance relationship for a year.,We’ve been in an LD relationship for a year.,,,
We are definitely going to the concert,"We’re going to the concert, LDO!",,,
Let me know if you are available this weekend.,LEMENO if you’re free this weekend.,,,
"I will be working for a bit, I need to get lunch.","I’ll be LERK for a bit, need to grab lunch.",,,
"The boss has low-frequency drama, and we will continue tomorrow.","The boss has LFD, we’ll continue tomorrow.",,,
I am looking for a group for tonight’s raid.,I’m LFG for tonight’s raid.,,,
Our headquarters is currently being assaulted; let's enthusiastically commence.,"Our base is under attack, LFG!",,,
We are seeking additional participants for the dungeon; we are looking for more.,"We need more players for the dungeon, LFM.",,,
"It is Friday night, let's get hammered.","It’s Friday night, LGH.",,,
"We have been flirting all evening, have we not?","We’ve been flirting all night, LH6?",,,
She texted me a message containing sexual content after the party.,She texted me LHSX after the party.,,,
"This project is very frustrating, Lord help me.","This project is driving me crazy, LHM.",,,
That story made me laugh hysterically.,That story had me LHO!,,,
I just updated my LinkedIn profile.,I just updated my LI profile.,,,
You do not like my opinion? Laughing internally consistently.,You don’t like my opinion? LIC!,,,
We require some alcoholic beverages for the social gathering.,We need some LIK for the party.,,,
"That joke was quite endearing, I love my life.","That joke was so cute, LIMT!",,,
The concert last night was exciting.,The concert last night was LIT!,,,
We were extremely exhilarated after that party.,We were so LIT after that party.,,,
"I must depart now, I love you, goodbye.","I’ve got to go now, LLGB.",,,
That meme caused me to laugh hysterically,That meme had me LLS!,,,
Your narrative is extremely amusing.,"Your story is hilarious, LMAO!",,,
I was laughing excessively.,"I couldn’t stop laughing, LMBO!",,,
That joke caused me to laugh uncontrollably.,That prank had me LMFAO!,,,
We have been communicating for weeks; let us meet in real life soon.,"We’ve been chatting for weeks, LMIRL sometime?",,,
Let me know if you need assistance with your project.,LMK if you need help with your project.,,,
That joke caused me to laugh to an excessive degree.,That joke had me LMMFAO!,,,
"I do not want to get involved, so leave me alone.","I don’t want to get involved, so LMNK.",,,
Like my status if you are ready for the weekend.,LMS if you’re ready for the weekend!,,,
"That joke did not make sense, it was not the best.","That joke didn’t make sense, it was LNT.",,,
Here is a letter of authorization for the project terms.,Here’s an LOA for the project terms.,,,
That feline video caused me to laugh aloud.,That cat video made me LOL!,,,
The movie was extremely humorous; I could not stop laughing.,"The movie was so funny, I couldn’t stop LOL.",,,
"I miss you, laughing out loud.","Miss you, LOL!",,,
That internet joke is making me laugh out loud with excitement.,That meme has me LOLH!,,,
I am sending you lots of love from a distance.,Sending you LOLO from across the miles.,,,
That situation was so unusual that I am both laughing and confused.,"That situation was so bizarre, I’m LOLWTF!",,,
"That was moderately amusing, but I am simply laughing on the inside.","That was mildly funny, but I’m just LOTI.",,,
I just rewatched The Lord of the Rings last weekend.,I just rewatched LOTR last weekend.,,,
That was quite humorous; I am laughing quietly to myself.,"That was pretty funny, I’m LQTM over here.",,,
That stand-up comedian made me laugh so hard my belly hurt.,That stand-up comedian had me LSHMBH!,,,
"This movie is rated for language, sex, and violence.",This movie is rated for LSV.,,,
"I just received a promotion, let's go.","I just got a promotion, LTD!",,,
"I am looking forward to the party, I love that laugh when you do that silly face","Can’t wait for the party, LTLWDLS!",,,
I am surprised to see you! It has been a long time since we last spoke. How have you been?,"Wow, LTNS! How have you been?",,,
"My old laptop keeps crashing, it is a lemon.","My old laptop keeps crashing, it’s an LTOD!",,,
I read your message and started crying.,I read your message and started LTS.,,,
"Thank you for your continuous presence, love you long time.","Thanks for always being there, LULT!",,,
I participated in the joke for the amusement.,I joined the prank for the LULZ.,,,
"I love you, call me back when you can.","I LVM, call me back when you can.",,,
"That was uninteresting, I am losing interest here.","That was so dry, I’m LWOS over here.",,,
"Goodnight, love you","Goodnight, LY!",,,
"You are the best, love you like a sister.","You’re the best, LYLAS!",,,
"You are amazing, love your life currently!","You’re amazing, LYLC!",,,
"I miss you, and I love you so much.","I miss you, LYSM!",,,
I just installed the latest update from Microsoft.,I just installed the latest update from M$.,,,
"How is everything, friend?","How’s it going, M8?",,,
He is always calling his mother for advice; he is such a Mama's Boy.,"He’s always calling his mom for advice, such an MB.",,,
"I am currently unable to discuss that, my bestie.","I can’t talk about that right now, MBS.",,,
Wishing you all a Merry Christmas and a Happy New Year!,Wishing you all a MC and a Happy New Year!,,,
"I am a member of the Massachusetts Department of Investigation and Criminal Application, so I am knowledgeable about law enforcement.","MDIAC, so I know a lot about law enforcement.",,,
"Whenever they discuss quantum physics, my eyes glaze over.","Whenever they talk about quantum physics, MEGO.",,,
"That movie was unremarkable, nothing special.","That movie was MEH, nothing special.",,,
The food was unremarkable; it was neither excellent nor poor.,"The food was MEH, not great but not terrible.",,,
It has been an exhausting day.,"It’s been a long day, MEHH.",,,
That performance was mesmerizing; I could not look away.,"That performance was MEZ, I couldn’t look away.",,,
I am extremely excited for the new season of the show.,I’m MFI for the new season of the show!,,,
My face when I found out the concert was canceled.,MFW I found out the concert was canceled.,,,
"Hope everything goes well, my good friend.","Hope everything goes well, MGB.",,,
I will check with management before making a decision.,I’ll check with MGMT before making a decision.,,,
"You did an amazing job, my hat's off to you.","You did an amazing job, MHOTY!",,,
This meme is very relatable to my life.,"This meme is so relatable, it’s MIRL.",,,
We have been communicating online for months; let us meet in real life soon.,"We’ve been talking online for months, let’s MIRL soon.",,,
"I am with my friend, we are going to the park.","I’m with MISS.3, we’re going to the park.",,,
"Is that your plan? Understood, that seems satisfactory.","That’s your plan? MKAY, sounds good.",,,
"He was behaving so offensively, so I reprimanded him with a Multi-Level Marketing scheme pitch.","He was being so rude, so I gave him the MLM.",,,
I am spending time with my maternal grandmother this weekend.,Hanging out with my MM this weekend.,,,
"You are coming over later, correct?",You’re coming over later? MMK?,,,
"Excuse me, I will return shortly.","Sorry, MNC—I’ll be right back.",,,
"I just received a message, can you help me translate it?","I just received an MNSG, can you help translate?",,,
The administrator was required to intervene and resolve the conflict.,The MOD had to step in and calm things down.,,,
I downloaded a new modification for the game.,I downloaded a new MOD for the game.,,,
You neglected to mention something important—was it something about being dead?,You didn’t mention—MORF?,,,
"He is heavily reliant on his mother, always contacting her for counsel.","He’s such a MOMBOY, always calling his mom for advice.",,,
"In my opinion, that is not the most effective approach.","In MOO, that’s not the best approach.",,,
Are you bringing an excess amount of food or refreshments to the party?,Are you bringing a MOOS to the party?,,,
"I am unable to discuss that at the present moment, mother or sister.","Can’t talk about that right now, MOS.",,,
We have a new Man of Serious Stature joining our team.,We’ve got a MOSS joining our team.,,,
I am lacking motivation and need to take a break.,"I’m out of MP, need to recharge.",,,
Spending the afternoon with my third romantic partner at the park.,Spending the afternoon with MR.3 at the park.,,,
I posted a modified version of that tweet with my own comment.,I made an MRT of that tweet with my own comment.,,,
My reaction when I discovered that the concert had been canceled.,MRW I found out the concert was canceled.,,,
I will send you a message later with the details.,I’ll send you an MSG later with the details.,,,
I will send the first draft now; there will be more to follow on updates.,"I’ll send the first draft now, MTF on updates.",,,
Good luck on your test! May the Force be with you!,Good luck on your test! MTFBWU!,,,
"It has been a long time since we socialized, my friend.","It’s been so long since we hung out, MU!",,,
"I attempted to tell a joke, but it was flawless.",I tried making a joke but it was MUAH.,,,
"I have not seen you in a long time, Master of Music.","Haven’t seen you in ages, MUSM!",,,
"Goodnight, kiss.","Goodnight, MWAH!",,,
"That is a private matter, mind your own business.","That’s personal, MYO!",,,
I will manage this by myself; mind your own business.,"I’ll handle it myself, MYOB.",,,
"Do not worry, everyone is a beginner initially.","Don’t worry, everyone’s a n00b at first.",,,
You performed exceptionally well on that presentation.,"You really aced that presentation, N1!",,,
What is happening with you? I have nothing much going on over here.,What’s up with you? N2M over here.,,,
What is new? Not a darn thing.,What’s new? NADT.,,,
"This plant is rare, not a lot of people know that.","This plant is rare, NALOPKT!",,,
"I was going to call, but I will not need to as the situation is resolved.","I was going to call, but NANA—it’s handled.",,,
I fixed the problem; it was not a big deal.,"I fixed the problem, NBD.",,,
"You are performing well for your initial attempt, which is commendable for a novice.","You’re doing great for your first try, NBFAB!",,,
"I love your new apartment, no cap.","I love your new place, NC!",,,
"You performed exceptionally well on two occasions, Noah Davis.","You hit two home runs, ND!",,,
Do you have any idea what time the show starts?,Do you have NE idea what time the show starts?,,,
Is anyone coming to the game tonight?,Is NE1 coming to the game tonight?,,,
They significantly weakened the abilities of my preferred character in the game.,They NERFed my favorite character in the game!,,,
"I will decline dessert, not for me.","I’ll pass on dessert, NFM.",,,
"I tried it, but it is not for me.","I tried it, but it’s NFM.",,,
"Not going to lie, that was the best meal I have had in a while.","NGL, that was the best meal I’ve had in a while.",,,
I am consumed by the desire to play Need for Speed.,I’m addicted to playing NFS.,,,
"That car is not for sale, I apologize.","That car is NFS, sorry!",,,
You acquired tickets to the concert? That is fantastic news!,You got tickets to the concert? NFW!,,,
"That meme is not suitable for work, do not open it in this location.","That meme is NFW, don’t open it here!",,,
"Exercise caution when opening that link, as it contains inappropriate content.","Be careful with that link, it’s NFWS.",,,
You executed that flawlessly and immediately.,"You played that perfectly, NH!",,,
"I am at home by myself, currently in the nude.","I’m home alone, NIFOC right now.",,,
"Oh, I misunderstood earlier, not gonna lie now.","Oh, I misunderstood earlier, NIGI now.",,,
"They are proposing a new building, but it is a total not-in-my-backyard situation.","They’re proposing a new building, but it’s a total NIMBY situation.",,,
"I will be right back, I need to take a quick nap for a few minutes.","BRB, NIROK for a few minutes.",,,
Please send the report no later than Friday.,Please send the report NLT Friday.,,,
"How are you? Nothing much, I am just spending time here.","What’s up? NM, just hanging out.",,,
"Wait, never mind, I found the answer.","Wait, NM, I found the answer.",,,
"You leveraged that opportunity effectively, never mind.","You played that card well, NM!",,,
"How are you doing? Nothing much here, I am just relaxing.","How’s it going? NMH, just relaxing.",,,
"What are your plans for this evening? Nothing much, just chilling.",What are you up to tonight? NMJC.,,,
"Hello. What is happening? Nothing much, you?",Hey! What’s going on? NMU?,,,
I told no one about the surprise.,I told NO1 about the surprise.,,,
That participant frequently lost the game; they are inexperienced.,"That player kept dying, total NOOB.",,,
He has extensive knowledge of computers.,He’s got some serious NOWL about computers.,,,
What is happening with you? That is none of your business.,What’s going on with you? NOYB!,,,
Thank you for your assistance. You are welcome.,Thanks for your help! NP!,,,
That person just gave me a task.,That NPC just gave me a quest.,,,
She is performing excellently as a Newly Qualified Teacher.,She’s doing great as an NQT!,,,
"You rolled two sixes, I will not be responding.","You got double sixes, NR!",,,
I just wanted to update you. No reply necessary.,I just wanted to update you—NRN.,,,
"You achieved a perfect score, no sweat.","You got 100 points, NS!",,,
"That bowling split was challenging, but no sweat.","That bowling split was tough, but NS!",,,
I am not seeking a committed relationship; I am only interested in a non-disclosure agreement.,"I’m not looking for anything serious, just NSA.",,,
"That video is not safe for life, do not watch it.","That video is NSFL, don’t watch it!",,,
"That image is not appropriate for the workplace, do not open it while at the office.","That image is NSFW, don’t open it at the office!",,,
"I believe the word is accommodate, but I am not certain of that.","I think it’s ‘accommodate,’ NSISR.",,,
"You were unsuccessful, but nice try.","You didn’t win, but NT!",,,
"How are you? I am not doing anything, just relaxing.","What’s up? NTHING, just relaxing.",,,
Note to self: Remember to send the email tomorrow.,NTS: Remember to send the email tomorrow.,,,
Please disregard my previous statement.,"Forget what I said, NVM.",,,
I would never do that,I’d NVR do that!,,,
You won the lottery? That is nice work.,You won the lottery? NW!,,,
This situation feels like it involves the New World Order.,This situation feels like there’s NWO.,,,
I saved the last slice of pizza for you.,I saved the last slice O4U!,,,
We are facing a tough obstacle in the next round.,We’re facing a tough O in the next round.,,,
"I am sending you love, and I hope you feel better shortly.","Sending you O, hope you feel better soon!",,,
"Mission accomplished, period.","Mission complete, O.",,,
I obtained an excellent agreement through OA.,I got a great deal through OA.,,,
Did you see the game last night?,"OATUS, did you see the game last night?",,,
"That was an amazing shot, honestly.","That was an amazing shot, OB!",,,
You lost your keys again? Obviously!,You lost your keys again? OB!,,,
"Obviously, I was going to say yes.","OBV, I was going to say yes!",,,
"Of course, I will be there tomorrow.",OFC I’ll be there tomorrow.,,,
He is the original figure in street style.,He’s the OG of street style.,,,
"The weekend passed very quickly, oh my God, it's Monday.","The weekend went by so fast, OGIM.",,,
I overheard a conversation at the coffee shop: I cannot believe they canceled the meeting.,OH at the coffee shop: ‘I can’t believe they canceled the meeting!’,,,
"Oh my goodness, that is very cute!","OHHEMMGEE, that’s so cute!",,,
"I will call you back later, I am busy right now.","I’ll call you back later, OI right now.",,,
"Oh, I'm back, what did I miss?","OIB, what did I miss?",,,
"Oh, I see, that makes sense now.","OIC, that makes sense now.",,,
Are you very upset? Just kidding.,You’re really mad? OJ!,,,
I am going to visit my older sister this weekend.,Going to visit my OL this weekend.,,,
I became acquainted with an individual through an online platform.,I met someone through OLL!,,,
I am going fishing with my significant other this weekend.,I’m going fishing with my OM this weekend.,,,
"Oh my goodness, I cannot believe that just occurred.","OM, I can’t believe that just happened!",,,
"After sitting all day, I am extremely tired.","After sitting all day, OMAA!",,,
You want to change my weekend plans? Over my dead body!,You want to change my weekend plans? OMDB!,,,
"Oh my goodness, that is incredible!","OMFG, that’s incredible!",,,
"Oh my goodness, I cannot believe it.","OMG, I can’t believe it!",,,
"Oh my goodness, you look wonderful.","OMG, you look amazing!",,,
"Oh my god, you have got to be kidding, that is the best news ever!","OMGYG2BK, that’s the best news ever!",,,
"Did you fail to score? Oh my goodness, yes.",You missed the shot? OMGYS!,,,
"Oh my stars, that is the truth.","OMS, that’s the truth!",,,
"I have just finished, and I am on my way now.","Just finished up, OMW now.",,,
I will be online tonight if you would like to converse.,I’ll be ONL tonight if you want to chat.,,,
I am finished with my work for the day.,"Finished for the day, OO!",,,
That statement was completely uncharacteristic of him.,That comment was totally OOC for him.,,,
"It is late, I am out of here.","It’s late, I’m OOH!",,,
One of my followers just liked my post on X.,OOMF just liked my tweet.,,,
"This is my outfit of the day, and I will finally visit Paris.","OOTD, I’ll finally visit Paris.",,,
Posting my outfit of the day for Instagram.,Posting my OOTD for Instagram.,,,
"I am out of the office until Monday, so I will reply at that time.","I’m OOTO until Monday, so I’ll reply then.",,,
I am unable to converse at this moment; I am too occupied with an important matter.,"Can’t talk right now, I’m OP.",,,
You have completed the project already? Is that so?,You finished the project already? ORLY?,,,
I am updating my operating system this evening.,I’m updating my OS tonight.,,,
"This might be off-topic, but did you watch the game yesterday evening?","This might be OT, but did you see the game last night?",,,
"It is late, I am going to bed now.","It’s late, OTB for me.",,,
That joke made me laugh uncontrollably.,That joke had me OTFL!,,,
"I am offline, and I will return in sixty minutes.","I’m OTL, back in an hour.",,,
"It is expensive, but on the other hand, it is a great investment.","It’s expensive, but OTOH, it’s a great investment.",,,
I am unable to speak at the moment because I am currently on the telephone.,"Can’t talk, I’m OTP right now.",,,
They are my favorite romantic couple from the program.,They’re my favorite OTP from the show.,,,
